{
  "case_id": "ohnd-replay-001",
  "created_at": "2026-10-24T03:00:00Z",
  "source": "doj_replay",
  "victim": { "alias": "Victim A.H.", "age_band": "60+", "exchange_used": "Coinbase" },
  "story": {
    "scam_app": "Fake investment app",
    "platform": "WhatsApp",
    "first_contact": "2024-02-01",
    "summary": "UI placeholder until examples/ohnd_replay.case.json lands. Replay of US v. 4,340,000 Tether (N.D. Ohio 1:25-cv-00386)."
  },
  "sends": [
    {
      "chain": "ethereum",
      "tx_hash": "",
      "from": "victim-sample",
      "to": "0xcf9bbfa762ef5a84ba3d25350de941a6db485027",
      "token": "USDT",
      "amount": 195859.0,
      "time": "2024-05-02T10:00:00Z"
    }
  ],
  "status": "traced"
}
